{"assurance":{"disclosure":"Distinct evaluator identities are workspace-minted keys; they prove agent-distinctness, not party-independence, on this self-run venue.","preset":"direct-check","resolved":{"distinctEvaluator":false,"independence":"disclosed","minVerdicts":1,"verdictRule":"sole"}},"attrition":{"asymmetryFlags":[],"perArm":{"baseline":{"excluded":0,"expected":3,"expired":0,"invalidated":0,"judged":3,"replacements":0,"unjudged":0,"unscorable":0},"sample-uniform":{"excluded":0,"expected":3,"expired":0,"invalidated":0,"judged":3,"replacements":0,"unjudged":0,"unscorable":0}}},"claimSchema":"benchmark-product.claim-package/1","completeness":{"expected":6,"floor":"1","judged":6,"runOutcome":"complete"},"conflicted":{"cellKeys":[],"count":0},"disclosures":{"integrityTierCounts":{"attested-only":0,"re-derivable":6},"perSubject":[{"attrition":{"asymmetryFlags":[],"perArm":{"baseline":{"excluded":0,"expected":3,"expired":0,"invalidated":0,"judged":3,"replacements":0,"unjudged":0,"unscorable":0},"sample-uniform":{"excluded":0,"expected":3,"expired":0,"invalidated":0,"judged":3,"replacements":0,"unjudged":0,"unscorable":0}}},"completeness":{"expected":6,"floor":"1","judged":6,"runOutcome":"complete"},"independence":0,"integrityTiers":{"attested-only":0,"re-derivable":6},"pinning":{"harness":{"match":6,"mismatch":0,"unverifiable":0},"isolation":{"match":6,"mismatch":0,"unverifiable":0},"loadout":{"match":0,"mismatch":0,"unverifiable":6},"model":{"match":0,"mismatch":0,"unverifiable":6}},"subjectSha256":"16bfe298a7deef8688e266841f083883743505918857df3cc7af7c6cddb2f4ca"}],"pinningUnverifiableCounts":{"harness":0,"isolation":0,"loadout":6,"model":6}},"headline":{"baseline":{"n":3,"passRate":"1.0000","wilsonInterval":{"high":"1.0000","low":"0.4385"}},"sample-uniform":{"n":3,"passRate":"1.0000","wilsonInterval":{"high":"1.0000","low":"0.4385"}}},"limitations":["This is a local, self-run venue: the same operator controls task dispatch, execution, and evaluation.","Pre-registration here is a discipline enforced by this tool, not a proof against the run's own owner — nothing prevents the owner from having altered the record before publishing it.","Run pinning on the harness, model, and loadout axes is enforced by an admission gate at dispatch time. The isolation axis is vacuous: this venue's launchers admit only one isolation policy, so matching it proves nothing about containment strength.","Cost figures, where present, are self-reported by this venue and were never independently settled.","Distinct solver and evaluator identities prove agent-distinctness only — each evaluator identity is backed by its own workspace-minted signing key, whose verdict signature this product verifies — not that they are independent real-world parties."],"method":{"id":"jinn.benchmarking.method/wilson","parameters":{"verdictRule":"sole"},"preregistered":true,"version":"1"},"records":{"benchmarkSha256":"c21f9eab990dabd54c08987c87f38f25e2a18ff86686e3c13131425c10b497ec","matrixSha256":"16bfe298a7deef8688e266841f083883743505918857df3cc7af7c6cddb2f4ca","reportEnvelopeSha256":"ad4875a41104b0aecdbc9fa87cf2c252efb82186163e0446e3891c201d9f0c43","reportSha256":"f1b8daff7e29db6eb8e046241b3baf06032f432eecaeb55afbc9762f3f5c37bd","runSha256":"5a640cbf3b60afee34b360cd1120823424d22e2c673c0db1c3bb58b557c11cbf"},"results":{"perSubject":[{"results":{"arms":{"baseline":{"n":3,"passRate":"1.0000","wilsonInterval":{"high":"1.0000","low":"0.4385"}},"sample-uniform":{"n":3,"passRate":"1.0000","wilsonInterval":{"high":"1.0000","low":"0.4385"}}},"conflicted":{"cellKeys":[],"count":0},"verdictRule":"sole"},"subjectSha256":"16bfe298a7deef8688e266841f083883743505918857df3cc7af7c6cddb2f4ca"}]},"scope":{"arms":[{"armId":"baseline","pinning":{"harness":{"id":"prediction-v1-baseline","version":"1.0.0"}}},{"armId":"sample-uniform","pinning":{"harness":{"id":"sample-uniform","version":"0.1.0"}}}],"benchmarkSha256":"c21f9eab990dabd54c08987c87f38f25e2a18ff86686e3c13131425c10b497ec","draftId":"conformance-golden","replicates":1,"taskCount":3,"venue":"self-run"},"venueHonesty":{"limits":["This is a local, self-run venue: the same operator controls task dispatch, execution, and evaluation.","Pre-registration here is a discipline enforced by this tool, not a proof against the run's own owner — nothing prevents the owner from having altered the record before publishing it.","Run pinning on the harness, model, and loadout axes is enforced by an admission gate at dispatch time. The isolation axis is vacuous: this venue's launchers admit only one isolation policy, so matching it proves nothing about containment strength.","Cost figures, where present, are self-reported by this venue and were never independently settled.","Distinct solver and evaluator identities prove agent-distinctness only — each evaluator identity is backed by its own workspace-minted signing key, whose verdict signature this product verifies — not that they are independent real-world parties."],"preRegistration":"structural-and-append-order-only","unverifiableAxisCounts":{"harness":0,"isolation":0,"loadout":6,"model":6},"venue":"self-run"},"verification":{"checks":["manifest","evidence-closure","trust","matrix-rederivation","report-verification","claim-consistency"],"command":"npx @colophon-claims/verify@1.0.0 <bundle-dir>","compatibleCommand":"npx @colophon-claims/verify@1 <bundle-dir>","trustRoot":"Signatures verify against the bundle-carried public keys minted by this workspace; there is no third-party trust anchor on the self-run venue."}}